{
  "setId": "set-96d9e127-4645-42a9-bdb9-95d17f719f83",
  "sources": [
    {
      "sourceId": "upload-1",
      "kind": "upload",
      "name": "basic-usd.pdf",
      "mime": "application/pdf"
    }
  ],
  "manifest": [
    {
      "mergedPage": 1,
      "sourceId": "upload-1",
      "sourcePage": 1
    }
  ],
  "pages": [
    {
      "mergedPage": 1,
      "width": 595.2755737304688,
      "height": 841.8897705078125,
      "items": [
        {
          "id": "p1i0",
          "text": "Deal Term Sheet",
          "x": 72,
          "y": 81.030029296875,
          "w": 90.69598388671875,
          "h": 13.3919677734375
        },
        {
          "id": "p1i1",
          "text": "Issuer: Goldman Sachs Incorporated",
          "x": 72,
          "y": 101.030029296875,
          "w": 195.41998291015625,
          "h": 13.3919677734375
        },
        {
          "id": "p1i2",
          "text": "Deal Amount: 1500000",
          "x": 72,
          "y": 121.030029296875,
          "w": 122.73597717285156,
          "h": 13.3919677734375
        },
        {
          "id": "p1i3",
          "text": "Currency: USD",
          "x": 72,
          "y": 141.030029296875,
          "w": 80.67599487304688,
          "h": 13.3919677734375
        },
        {
          "id": "p1i4",
          "text": "Settlement Date: 2026-10-15",
          "x": 72,
          "y": 161.030029296875,
          "w": 154.07997131347656,
          "h": 13.3919677734375
        },
        {
          "id": "p1i5",
          "text": "Confidential: true",
          "x": 72,
          "y": 181.030029296875,
          "w": 90.7080078125,
          "h": 13.3919677734375
        },
        {
          "id": "p1i6",
          "text": "Fee Type: Fixed",
          "x": 72,
          "y": 201.030029296875,
          "w": 86.69998168945312,
          "h": 13.3919677734375
        },
        {
          "id": "p1i7",
          "text": "Party: Goldman Sachs Incorporated Role: Issuer Amount: 250000",
          "x": 72,
          "y": 221.030029296875,
          "w": 349.4999084472656,
          "h": 13.3919677734375
        }
      ]
    }
  ]
}
