{
  "setId": "set1",
  "sources": [
    {
      "sourceId": "src1",
      "kind": "upload",
      "name": "term-sheet.pdf",
      "mime": "application/pdf"
    }
  ],
  "manifest": [
    {
      "mergedPage": 3,
      "sourceId": "src1",
      "sourcePage": 1
    }
  ],
  "pages": [
    {
      "mergedPage": 3,
      "width": 612.0,
      "height": 792.0,
      "items": [
        {
          "id": "p3i17",
          "text": "Goldman Sachs Incorporated",
          "x": 72.0,
          "y": 144.5,
          "w": 180.25,
          "h": 12.0
        }
      ]
    }
  ]
}
