{
  "setId": "set-389b9ad4-58f5-474c-8108-32081da29299",
  "sources": [
    {
      "sourceId": "upload-1",
      "kind": "upload",
      "name": "eur-variable.pdf",
      "mime": "application/pdf"
    }
  ],
  "manifest": [
    {
      "mergedPage": 1,
      "sourceId": "upload-1",
      "sourcePage": 1
    }
  ],
  "pages": [
    {
      "mergedPage": 1,
      "width": 595.2755737304688,
      "height": 841.8897705078125,
      "items": [
        {
          "id": "p1i0",
          "text": "Deal Term Sheet",
          "x": 72,
          "y": 81.030029296875,
          "w": 90.69598388671875,
          "h": 13.3919677734375
        },
        {
          "id": "p1i1",
          "text": "Issuer: Bridge Partners Limited",
          "x": 72,
          "y": 101.030029296875,
          "w": 164.72398376464844,
          "h": 13.3919677734375
        },
        {
          "id": "p1i2",
          "text": "Deal Amount: 2750000",
          "x": 72,
          "y": 121.030029296875,
          "w": 122.73597717285156,
          "h": 13.3919677734375
        },
        {
          "id": "p1i3",
          "text": "Currency: EUR",
          "x": 72,
          "y": 141.030029296875,
          "w": 80.67599487304688,
          "h": 13.3919677734375
        },
        {
          "id": "p1i4",
          "text": "Settlement Date: 2026-11-30",
          "x": 72,
          "y": 161.030029296875,
          "w": 154.07997131347656,
          "h": 13.3919677734375
        },
        {
          "id": "p1i5",
          "text": "Confidential: false",
          "x": 72,
          "y": 181.030029296875,
          "w": 95.37600708007812,
          "h": 13.3919677734375
        },
        {
          "id": "p1i6",
          "text": "Fee Type: Variable",
          "x": 72,
          "y": 201.030029296875,
          "w": 101.37599182128906,
          "h": 13.3919677734375
        },
        {
          "id": "p1i7",
          "text": "Party: Bridge Partners Limited Role: Agent Amount: 125000",
          "x": 72,
          "y": 221.030029296875,
          "w": 317.48394775390625,
          "h": 13.3919677734375
        }
      ]
    }
  ]
}
