{
  "setId": "set-fcf72153-732a-4a8c-ad79-c81ab41e9533",
  "sources": [
    {
      "sourceId": "upload-1",
      "kind": "upload",
      "name": "settlement_simple.pdf",
      "mime": "application/pdf"
    }
  ],
  "manifest": [
    {
      "mergedPage": 1,
      "sourceId": "upload-1",
      "sourcePage": 1
    }
  ],
  "pages": [
    {
      "mergedPage": 1,
      "width": 595.2755737304688,
      "height": 841.8897705078125,
      "items": [
        {
          "id": "p1i0",
          "text": "SETTLEMENT STATEMENT",
          "x": 50,
          "y": 37.33026123046875,
          "w": 182.78399658203125,
          "h": 15.62396240234375
        },
        {
          "id": "p1i1",
          "text": "Issuer name:",
          "x": 50,
          "y": 70.04522705078125,
          "w": 67.85900115966797,
          "h": 12.2760009765625
        },
        {
          "id": "p1i2",
          "text": "JPMorgan Chase Bank",
          "x": 180,
          "y": 70.04522705078125,
          "w": 113.10198974609375,
          "h": 12.2760009765625
        },
        {
          "id": "p1i3",
          "text": "Deal amount:",
          "x": 50,
          "y": 90.04522705078125,
          "w": 69.67400360107422,
          "h": 12.2760009765625
        },
        {
          "id": "p1i4",
          "text": "1025000",
          "x": 180,
          "y": 90.04522705078125,
          "w": 42.81199645996094,
          "h": 12.2760009765625
        },
        {
          "id": "p1i5",
          "text": "Currency:",
          "x": 50,
          "y": 110.04522705078125,
          "w": 51.9530029296875,
          "h": 12.2760009765625
        },
        {
          "id": "p1i6",
          "text": "EUR",
          "x": 180,
          "y": 110.04522705078125,
          "w": 23.220993041992188,
          "h": 12.2760009765625
        },
        {
          "id": "p1i7",
          "text": "Settlement date:",
          "x": 50,
          "y": 130.04522705078125,
          "w": 85.56900024414062,
          "h": 12.2760009765625
        },
        {
          "id": "p1i8",
          "text": "09/23/2026",
          "x": 180,
          "y": 130.04522705078125,
          "w": 55.04400634765625,
          "h": 12.2760009765625
        },
        {
          "id": "p1i9",
          "text": "Confidential:",
          "x": 50,
          "y": 150.04522705078125,
          "w": 67.22100067138672,
          "h": 12.2760009765625
        },
        {
          "id": "p1i10",
          "text": "Yes",
          "x": 180,
          "y": 150.04522705078125,
          "w": 18.9530029296875,
          "h": 12.2760009765625
        },
        {
          "id": "p1i11",
          "text": "Fee type:",
          "x": 50,
          "y": 170.04522705078125,
          "w": 48.28999328613281,
          "h": 12.2760009765625
        },
        {
          "id": "p1i12",
          "text": "Variable",
          "x": 180,
          "y": 170.04522705078125,
          "w": 40.347991943359375,
          "h": 12.2760009765625
        },
        {
          "id": "p1i13",
          "text": "Parties",
          "x": 50,
          "y": 199.1402587890625,
          "w": 40.02000427246094,
          "h": 13.3919677734375
        },
        {
          "id": "p1i14",
          "text": "Party 1 name:",
          "x": 50,
          "y": 220.04522705078125,
          "w": 72.13800048828125,
          "h": 12.2760009765625
        },
        {
          "id": "p1i15",
          "text": "jpm",
          "x": 179.5050048828125,
          "y": 220.04522705078125,
          "w": 18.215988159179688,
          "h": 12.2760009765625
        },
        {
          "id": "p1i16",
          "text": "Party 1 role:",
          "x": 50,
          "y": 238.04522705078125,
          "w": 63.58000183105469,
          "h": 12.2760009765625
        },
        {
          "id": "p1i17",
          "text": "Agent",
          "x": 180,
          "y": 238.04522705078125,
          "w": 28.742996215820312,
          "h": 12.2760009765625
        },
        {
          "id": "p1i18",
          "text": "Party 1 amount:",
          "x": 50,
          "y": 256.04522705078125,
          "w": 83.12701416015625,
          "h": 12.2760009765625
        },
        {
          "id": "p1i19",
          "text": "10000",
          "x": 180,
          "y": 256.04522705078125,
          "w": 30.580001831054688,
          "h": 12.2760009765625
        },
        {
          "id": "p1i20",
          "text": "Party 2 name:",
          "x": 50,
          "y": 280.04522705078125,
          "w": 72.13800048828125,
          "h": 12.2760009765625
        },
        {
          "id": "p1i21",
          "text": "morgan stanley",
          "x": 180,
          "y": 280.04522705078125,
          "w": 75.19601440429688,
          "h": 12.2760009765625
        },
        {
          "id": "p1i22",
          "text": "Party 2 role:",
          "x": 50,
          "y": 298.04522705078125,
          "w": 63.58000183105469,
          "h": 12.2760009765625
        },
        {
          "id": "p1i23",
          "text": "Guarantor",
          "x": 180,
          "y": 298.04522705078125,
          "w": 49.675994873046875,
          "h": 12.2760009765625
        },
        {
          "id": "p1i24",
          "text": "Party 2 amount:",
          "x": 50,
          "y": 316.04522705078125,
          "w": 83.12701416015625,
          "h": 12.2760009765625
        },
        {
          "id": "p1i25",
          "text": "100000",
          "x": 180,
          "y": 316.04522705078125,
          "w": 36.69599914550781,
          "h": 12.2760009765625
        }
      ]
    }
  ]
}