{
  "setId": "set-ca1528de-6d10-48b1-86ec-803924b69b4e",
  "sources": [
    {
      "sourceId": "upload-1",
      "kind": "upload",
      "name": "settlement_table.pdf",
      "mime": "application/pdf"
    }
  ],
  "manifest": [
    {
      "mergedPage": 1,
      "sourceId": "upload-1",
      "sourcePage": 1
    }
  ],
  "pages": [
    {
      "mergedPage": 1,
      "width": 595.2755737304688,
      "height": 841.8897705078125,
      "items": [
        {
          "id": "p1i0",
          "text": "TRADE SETTLEMENT ADVICE",
          "x": 167.63279724121094,
          "y": 64.40313720703125,
          "w": 260.00994873046875,
          "h": 20.08795166015625
        },
        {
          "id": "p1i1",
          "text": "Reference: SA-2026-0923-014 | Status: Confirmed",
          "x": 78,
          "y": 91.64312744140625,
          "w": 224.36996459960938,
          "h": 11.15997314453125
        },
        {
          "id": "p1i2",
          "text": "1. Deal Summary",
          "x": 78,
          "y": 138.7003173828125,
          "w": 112.82598876953125,
          "h": 15.62396240234375
        },
        {
          "id": "p1i3",
          "text": "Issuer name",
          "x": 91.03936767578125,
          "y": 165.3203125,
          "w": 58.36000061035156,
          "h": 11.15997314453125
        },
        {
          "id": "p1i4",
          "text": "JPMorgan Chase Bank",
          "x": 261.1180725097656,
          "y": 165.3203125,
          "w": 102.81997680664062,
          "h": 11.15997314453125
        },
        {
          "id": "p1i5",
          "text": "Deal amount",
          "x": 91.03936767578125,
          "y": 183.3203125,
          "w": 60.010009765625,
          "h": 11.15997314453125
        },
        {
          "id": "p1i6",
          "text": "1025000",
          "x": 261.1180725097656,
          "y": 183.3203125,
          "w": 38.920013427734375,
          "h": 11.15997314453125
        },
        {
          "id": "p1i7",
          "text": "Currency",
          "x": 91.03936767578125,
          "y": 201.3203125,
          "w": 43.899993896484375,
          "h": 11.15997314453125
        },
        {
          "id": "p1i8",
          "text": "EUR",
          "x": 261.1180725097656,
          "y": 201.3203125,
          "w": 21.1099853515625,
          "h": 11.15997314453125
        },
        {
          "id": "p1i9",
          "text": "Settlement date",
          "x": 91.03936767578125,
          "y": 219.3203125,
          "w": 74.45999145507812,
          "h": 11.15997314453125
        },
        {
          "id": "p1i10",
          "text": "09/23/2026",
          "x": 261.1180725097656,
          "y": 219.3203125,
          "w": 50.040008544921875,
          "h": 11.15997314453125
        },
        {
          "id": "p1i11",
          "text": "Confidential",
          "x": 91.03936767578125,
          "y": 237.3203125,
          "w": 57.779998779296875,
          "h": 11.15997314453125
        },
        {
          "id": "p1i12",
          "text": "Yes",
          "x": 261.1180725097656,
          "y": 237.3203125,
          "w": 17.230010986328125,
          "h": 11.15997314453125
        },
        {
          "id": "p1i13",
          "text": "Fee type",
          "x": 91.03936767578125,
          "y": 255.3203125,
          "w": 40.56999206542969,
          "h": 11.15997314453125
        },
        {
          "id": "p1i14",
          "text": "Variable",
          "x": 261.1180725097656,
          "y": 255.3203125,
          "w": 36.67999267578125,
          "h": 11.15997314453125
        },
        {
          "id": "p1i15",
          "text": "Deal amount (formatted)",
          "x": 91.03936767578125,
          "y": 273.3203125,
          "w": 115.56001281738281,
          "h": 11.15997314453125
        },
        {
          "id": "p1i16",
          "text": "EUR 1,025,000.00",
          "x": 261.1180725097656,
          "y": 273.3203125,
          "w": 82.26998901367188,
          "h": 11.15997314453125
        },
        {
          "id": "p1i17",
          "text": "2. Party Allocation",
          "x": 78,
          "y": 323.37750244140625,
          "w": 122.14997863769531,
          "h": 15.6240234375
        },
        {
          "id": "p1i18",
          "text": "Party name",
          "x": 91.03936767578125,
          "y": 349.9975280761719,
          "w": 53.910003662109375,
          "h": 11.15997314453125
        },
        {
          "id": "p1i19",
          "text": "Role",
          "x": 246.9448699951172,
          "y": 349.9975280761719,
          "w": 21.669998168945312,
          "h": 11.15997314453125
        },
        {
          "id": "p1i20",
          "text": "Amount",
          "x": 346.157470703125,
          "y": 349.9975280761719,
          "w": 37.77001953125,
          "h": 11.15997314453125
        },
        {
          "id": "p1i21",
          "text": "Currency",
          "x": 445.37005615234375,
          "y": 349.9975280761719,
          "w": 43.899993896484375,
          "h": 11.15997314453125
        },
        {
          "id": "p1i22",
          "text": "jpm",
          "x": 90.58937072753906,
          "y": 367.9975280761719,
          "w": 16.55999755859375,
          "h": 11.15997314453125
        },
        {
          "id": "p1i23",
          "text": "Agent",
          "x": 246.9448699951172,
          "y": 367.9975280761719,
          "w": 26.129989624023438,
          "h": 11.15997314453125
        },
        {
          "id": "p1i24",
          "text": "10,000.00",
          "x": 388.89007568359375,
          "y": 367.9975280761719,
          "w": 44.47998046875,
          "h": 11.15997314453125
        },
        {
          "id": "p1i25",
          "text": "| EUR",
          "x": 438.239990234375,
          "y": 367.9975280761719,
          "w": 28.240081787109375,
          "h": 13.60247802734375
        },
        {
          "id": "p1i26",
          "text": "morgan stanley",
          "x": 91.03936767578125,
          "y": 385.9975280761719,
          "w": 68.36000061035156,
          "h": 11.15997314453125
        },
        {
          "id": "p1i27",
          "text": "Guarantor",
          "x": 246.9448699951172,
          "y": 385.9975280761719,
          "w": 45.15998840332031,
          "h": 11.15997314453125
        },
        {
          "id": "p1i28",
          "text": "100,000.00 | EUR",
          "x": 383.330078125,
          "y": 385.91998291015625,
          "w": 83.14999389648438,
          "h": 13.44000244140625
        },
        {
          "id": "p1i29",
          "text": "Notes: This advice is issued on a confidential basis. Fees are calculated on a variable schedule per",
          "x": 78,
          "y": 423.67462158203125,
          "w": 438.669921875,
          "h": 11.15997314453125
        },
        {
          "id": "p1i30",
          "text": "the underlying agreement.",
          "x": 78,
          "y": 435.67462158203125,
          "w": 116.16998291015625,
          "h": 11.15997314453125
        }
      ]
    }
  ]
}