{
  "setId": "set-4ac678c9-8d50-4f2b-b24e-a83388137125",
  "sources": [
    {
      "sourceId": "upload-1",
      "kind": "upload",
      "name": "gbp-two-parties.pdf",
      "mime": "application/pdf"
    }
  ],
  "manifest": [
    {
      "mergedPage": 1,
      "sourceId": "upload-1",
      "sourcePage": 1
    },
    {
      "mergedPage": 2,
      "sourceId": "upload-1",
      "sourcePage": 2
    }
  ],
  "pages": [
    {
      "mergedPage": 1,
      "width": 595.2755737304688,
      "height": 841.8897705078125,
      "items": [
        {
          "id": "p1i0",
          "text": "Deal Term Sheet",
          "x": 72,
          "y": 81.030029296875,
          "w": 90.69598388671875,
          "h": 13.3919677734375
        },
        {
          "id": "p1i1",
          "text": "Issuer: Kestrel Capital Group",
          "x": 72,
          "y": 101.030029296875,
          "w": 154.0559844970703,
          "h": 13.3919677734375
        },
        {
          "id": "p1i2",
          "text": "Deal Amount: 980000",
          "x": 72,
          "y": 121.030029296875,
          "w": 116.06398010253906,
          "h": 13.3919677734375
        },
        {
          "id": "p1i3",
          "text": "Currency: GBP",
          "x": 72,
          "y": 141.030029296875,
          "w": 80.68798828125,
          "h": 13.3919677734375
        },
        {
          "id": "p1i4",
          "text": "Settlement Date: 2027-01-22",
          "x": 72,
          "y": 161.030029296875,
          "w": 154.07997131347656,
          "h": 13.3919677734375
        },
        {
          "id": "p1i5",
          "text": "Confidential: true",
          "x": 72,
          "y": 181.030029296875,
          "w": 90.7080078125,
          "h": 13.3919677734375
        },
        {
          "id": "p1i6",
          "text": "Fee Type: Fixed",
          "x": 72,
          "y": 201.030029296875,
          "w": 86.69998168945312,
          "h": 13.3919677734375
        }
      ]
    },
    {
      "mergedPage": 2,
      "width": 595.2755737304688,
      "height": 841.8897705078125,
      "items": [
        {
          "id": "p2i0",
          "text": "Parties",
          "x": 72,
          "y": 81.030029296875,
          "w": 37.343994140625,
          "h": 13.3919677734375
        },
        {
          "id": "p2i1",
          "text": "Party: Kestrel Capital Group Role: Issuer Amount: 980000",
          "x": 72,
          "y": 101.030029296875,
          "w": 308.13592529296875,
          "h": 13.3919677734375
        },
        {
          "id": "p2i2",
          "text": "Party: Meridian Trading LLC Role: Agent Amount: 300000",
          "x": 72,
          "y": 121.030029296875,
          "w": 307.4759521484375,
          "h": 13.3919677734375
        }
      ]
    }
  ]
}
